{
  "context": {
    "callee_contracts": [],
    "existing_contracts": [],
    "symbols": [
      { "name": "result", "role": "result", "type": "i32" },
      { "name": "value", "role": "parameter", "type": "i32" }
    ]
  },
  "schema": "codeskeptic.contract-proposal-request/v1",
  "source": {
    "file": "C:/checkout/src/math.cpp",
    "line": 40
  },
  "target": {
    "body": "{\n  if (value < 0) {\n    return 0;\n  }\n  return value;\n}",
    "function": "clamp_nonnegative",
    "language": "c++17",
    "signature": "int clamp_nonnegative(int value)"
  }
}